{
  "$schema": "https://json-schema.org/draft/2020-12/schema",
  "$id": "https://goreecloud.com/schemas/glaze-ui/v1.7-theme-transition-system.schema.json",
  "title": "Glaze UI V1.7 Theme Transition System Development Contract",
  "type": "object",
  "additionalProperties": false,
  "required": [
    "$schema","schemaVersion","contractId","name","version","lifecycle","stableBaseline","consumerEligible",
    "planVersion","v12SpecificationSections","dependsOn","governedProperties","requestPolicy","resultPolicy",
    "transitionPolicy","authority","accessibility","performance","glazeMotionBoundary","acceptanceBoundary",
    "runtimeEntrypoint","developmentAggregateEntrypoint","tokenMap","researchRecord","sourceAuthorities"
  ],
  "properties": {
    "$schema": {"const":"../../schemas/v1.7-theme-transition-system.schema.json"},
    "schemaVersion": {"const":1},
    "contractId": {"const":"goreecloud.glaze-ui.v1.7.theme-transition-system"},
    "name": {"const":"Glaze UI V1.7 Theme Transition System Development Contract"},
    "version": {"const":"1.7.0-dev.20"},
    "lifecycle": {"const":"Development"},
    "stableBaseline": {"const":"1.6.0"},
    "consumerEligible": {"const":false},
    "planVersion": {"const":"v1.2"},
    "v12SpecificationSections": {"const":[28]},
    "dependsOn": {"type":"object","minProperties":4},
    "governedProperties": {"type":"array","minItems":8,"maxItems":8,"uniqueItems":true,"items":{"type":"string","minLength":1}},
    "requestPolicy": {"type":"object","minProperties":11},
    "resultPolicy": {"type":"object","minProperties":5},
    "transitionPolicy": {"type":"object","minProperties":6},
    "authority": {"type":"object","minProperties":6},
    "accessibility": {"type":"object","minProperties":6},
    "performance": {"type":"object","minProperties":4},
    "glazeMotionBoundary": {"type":"object","minProperties":5},
    "acceptanceBoundary": {"type":"object","minProperties":19},
    "runtimeEntrypoint": {"const":"js/glaze-v1.7-theme-transition-system.dev.mjs"},
    "developmentAggregateEntrypoint": {"const":"js/glaze-v1.7-development.mjs"},
    "tokenMap": {"const":"tokens/glaze-v1.7-theme-transition-system.dev.json"},
    "researchRecord": {"const":"docs/development/v1.7-theme-transition-system-open-source-research-20260926.md"},
    "sourceAuthorities": {"type":"array","minItems":4,"uniqueItems":true,"items":{"type":"string","minLength":1}}
  }
}
